[
  {
    "source_id": "onemap-basemap",
    "organisation": "Singapore Land Authority / OneMap",
    "title": "OneMap basemap services and attribution requirements",
    "url": "https://www.onemap.gov.sg/docs/maps/index.html",
    "access_date": "2026-09-14",
    "publication_date": null,
    "update_date": null,
    "licence": "Streamed basemap embedding per official service documentation; required OneMap logo and source attribution. No local tile archive or redistribution.",
    "terms_url": "https://www.onemap.gov.sg/legal/apitermsofservice.html",
    "redistribution_status": "permitted",
    "intended_use": "Viewport-limited client-side display of OneMap Default/Grey and Satellite orthophoto tiles with OneMap/SLA attribution. No local imagery archive or copied 3D meshes.",
    "asset_ids": [],
    "reliability_level": "primary",
    "notes": "Base tiles in EPSG:3857, zoom 11\u201319. Present-day reference only; map update epoch varies by tile. No historical reconstruction implied. Service availability remains external. SLA OneMap3D launch publication explicitly describes orthophoto as a photographic basemap. Satellite XYZ endpoint verified HTTP 200 on 2026-09-14; capture dates are not known and imagery is not live. Satellite is not listed among the four older basemap examples, so service continuity is not guaranteed."
  },
  {
    "source_id": "osm-cbd-buildings",
    "organisation": "OpenStreetMap contributors",
    "title": "Bounded CBD building-footprint extract",
    "url": "https://api.openstreetmap.org/api/0.6/map?bbox=103.845,1.276,103.866,1.3",
    "access_date": "2026-09-14",
    "publication_date": null,
    "update_date": null,
    "licence": "Open Database Licence 1.0 (ODbL); attribution and share-alike for the derived database.",
    "terms_url": "https://www.openstreetmap.org/copyright",
    "redistribution_status": "permitted",
    "intended_use": "Publish the filtered, transformed footprint database under ODbL and render simplified building massing. Per-feature source IDs and height-basis labels remain available.",
    "asset_ids": [],
    "reliability_level": "primary",
    "notes": "Community mapping is not independently verified. Actual OSM height tags, floor-count-derived estimates and illustrative defaults are distinguished. Partial CBD coverage only. Public surface context, not underground infrastructure or access geometry. Overpass queries timed out; one smaller bounded core API map response succeeded."
  },
  {
    "source_id": "onemap-mrt-stations",
    "organisation": "Singapore Land Authority / OneMap",
    "title": "Named MRT station search references",
    "url": "https://www.onemap.gov.sg/api/common/elastic/search",
    "access_date": "2026-09-14",
    "publication_date": null,
    "update_date": null,
    "licence": "Singapore Open Data Licence 1.0; source and access-date attribution; no agency endorsement.",
    "terms_url": "https://www.onemap.gov.sg/legal/apitermsofservice.html",
    "redistribution_status": "permitted",
    "intended_use": "Offline station-position comparison and attributed geographic network display.",
    "asset_ids": [],
    "reliability_level": "primary",
    "notes": "Selected station results retained offline with original SEARCHVAL, X/Y and longitude/latitude. Not exit coordinates. Planned CR/JRL platform matches excluded. Interchanges use the explicitly identified named platform reference, not an averaged centre. Search response included results alongside a token warning; no credentials or access-control bypass used. No runtime geocoding dependency."
  },
  {
    "source_id": "lta-mrt-footprints",
    "organisation": "Land Transport Authority",
    "title": "Train Station March 2026 geospatial extract",
    "url": "https://datamall.lta.gov.sg/content/dam/datamall/datasets/Geospatial/TrainStation_Mar2026.zip",
    "access_date": "2026-09-14",
    "publication_date": null,
    "update_date": null,
    "licence": "Singapore Open Data Licence 1.0; source and access-date attribution; no agency endorsement.",
    "terms_url": "https://datamall.lta.gov.sg/content/datamall/en/SingaporeOpenDataLicence.html",
    "redistribution_status": "permitted",
    "intended_use": "Offline station-position comparison and attributed geographic network display.",
    "asset_ids": [],
    "reliability_level": "primary",
    "notes": "231 polygon features in SVY21 per supplied PRJ, including unopened stations. Used only for coordinate review, not treated as station-point data. March extract lacks the three July CCL6 stations. Dataset-specific Open Data Licence permits reuse with attribution; general website artwork is not copied."
  }
]
