[
  {
    "source_id": "barrage-src-overview",
    "organisation": "PUB",
    "title": "Marina Barrage",
    "url": "https://www.pub.gov.sg/Public/Places-of-Interest/Marina-Barrage",
    "access_date": "2026-09-14",
    "publication_date": null,
    "update_date": null,
    "licence": "Copyright retained by source owner. Factual synthesis and links only; no media redistribution clearance.",
    "terms_url": null,
    "redistribution_status": "unverified",
    "intended_use": "Research and original schematic explanations; no source artwork, photographs, maps or drawings imported.",
    "asset_ids": [],
    "reliability_level": "primary",
    "notes": "Unknown publication dates retained as null; access date is not publication date. Source scope and limitations are recorded per claim."
  },
  {
    "source_id": "barrage-src-brochure",
    "organisation": "PUB",
    "title": "Bask in Marina Barrage",
    "url": "https://www.pub.gov.sg/-/media/Images/Feature/Content-Pages/Resources/Publications/Pdfs/Bask-in-MB_2210.pdf",
    "access_date": "2026-09-14",
    "publication_date": null,
    "update_date": null,
    "licence": "Copyright retained by source owner. Factual synthesis and links only; no media redistribution clearance.",
    "terms_url": null,
    "redistribution_status": "unverified",
    "intended_use": "Research and original schematic explanations; no source artwork, photographs, maps or drawings imported.",
    "asset_ids": [],
    "reliability_level": "primary",
    "notes": "Unknown publication dates retained as null; access date is not publication date. Source scope and limitations are recorded per claim."
  },
  {
    "source_id": "barrage-src-faq",
    "organisation": "PUB",
    "title": "Marina Barrage FAQs",
    "url": "https://www.pub.gov.sg/Public/Places-of-Interest/Marina-Barrage/FAQs",
    "access_date": "2026-09-14",
    "publication_date": null,
    "update_date": null,
    "licence": "Copyright retained by source owner. Factual synthesis and links only; no media redistribution clearance.",
    "terms_url": null,
    "redistribution_status": "unverified",
    "intended_use": "Research and original schematic explanations; no source artwork, photographs, maps or drawings imported.",
    "asset_ids": [],
    "reliability_level": "primary",
    "notes": "Unknown publication dates retained as null; access date is not publication date. Source scope and limitations are recorded per claim."
  },
  {
    "source_id": "barrage-src-catchment",
    "organisation": "PUB",
    "title": "Local Catchment Water",
    "url": "https://www.pub.gov.sg/Public/WaterLoop/OurWaterStory/Local-Catchment-Water",
    "access_date": "2026-09-14",
    "publication_date": null,
    "update_date": null,
    "licence": "Copyright retained by source owner. Factual synthesis and links only; no media redistribution clearance.",
    "terms_url": null,
    "redistribution_status": "unverified",
    "intended_use": "Research and original schematic explanations; no source artwork, photographs, maps or drawings imported.",
    "asset_ids": [],
    "reliability_level": "primary",
    "notes": "Unknown publication dates retained as null; access date is not publication date. Source scope and limitations are recorded per claim."
  },
  {
    "source_id": "barrage-src-history",
    "organisation": "Centre for Liveable Cities",
    "title": "Water: From Scarce Resource to National Asset, revised",
    "url": "https://www.clc.gov.sg/docs/default-source/urban-systems-studies/uss-water-revised.pdf",
    "access_date": "2026-09-14",
    "publication_date": null,
    "update_date": null,
    "licence": "Copyright retained by source owner. Factual synthesis and links only; no media redistribution clearance.",
    "terms_url": null,
    "redistribution_status": "unverified",
    "intended_use": "Research and original schematic explanations; no source artwork, photographs, maps or drawings imported.",
    "asset_ids": [],
    "reliability_level": "primary",
    "notes": "Unknown publication dates retained as null; access date is not publication date. Source scope and limitations are recorded per claim."
  },
  {
    "source_id": "barrage-src-builder",
    "organisation": "Koh Brothers",
    "title": "Marina Barrage (2008), Projects",
    "url": "https://www.kohbrothers.com/projects",
    "access_date": "2026-09-14",
    "publication_date": null,
    "update_date": null,
    "licence": "Copyright retained by source owner. Factual synthesis and links only; no media redistribution clearance.",
    "terms_url": null,
    "redistribution_status": "unverified",
    "intended_use": "Research and original schematic explanations; no source artwork, photographs, maps or drawings imported.",
    "asset_ids": [],
    "reliability_level": "primary",
    "notes": "Unknown publication dates retained as null; access date is not publication date. Source scope and limitations are recorded per claim."
  },
  {
    "source_id": "barrage-src-dewatering",
    "organisation": "Tsurumi",
    "title": "Marina Barrage construction case study",
    "url": "https://ae.tsurumi-global.com/projects/case/10.php",
    "access_date": "2026-09-14",
    "publication_date": null,
    "update_date": null,
    "licence": "Copyright retained by source owner. Factual synthesis and links only; no media redistribution clearance.",
    "terms_url": null,
    "redistribution_status": "unverified",
    "intended_use": "Research and original schematic explanations; no source artwork, photographs, maps or drawings imported.",
    "asset_ids": [],
    "reliability_level": "primary",
    "notes": "Unknown publication dates retained as null; access date is not publication date. Source scope and limitations are recorded per claim."
  },
  {
    "source_id": "barrage-src-paper",
    "organisation": "Moh and Su / PUB; Structural Engineering International",
    "title": "Marina Barrage \u2013 A Unique 3-in-1 Project in Singapore",
    "url": "https://doi.org/10.2749/101686609787398399",
    "access_date": "2026-09-14",
    "publication_date": "2009-02-01",
    "update_date": null,
    "licence": "Copyright retained by source owner. Factual synthesis and links only; no media redistribution clearance.",
    "terms_url": null,
    "redistribution_status": "unverified",
    "intended_use": "Research and original schematic explanations; no source artwork, photographs, maps or drawings imported.",
    "asset_ids": [],
    "reliability_level": "primary",
    "notes": "2009 journal issue; publisher online date 2018-03-23. Indexed metadata/abstract only; full primary-host paper unavailable. Exact construction details excluded."
  },
  {
    "source_id": "barrage-src-future",
    "organisation": "PUB",
    "title": "Coastal barriers: City-East Coast study completion",
    "url": "https://www.pub.gov.sg/Resources/News-Room/PressReleases/2025/08/Coastal-Barriers",
    "access_date": "2026-09-14",
    "publication_date": "2025-08-30",
    "update_date": null,
    "licence": "Copyright retained by source owner. Factual synthesis and links only; no media redistribution clearance.",
    "terms_url": null,
    "redistribution_status": "unverified",
    "intended_use": "Research and original schematic explanations; no source artwork, photographs, maps or drawings imported.",
    "asset_ids": [],
    "reliability_level": "primary",
    "notes": "Unknown publication dates retained as null; access date is not publication date. Source scope and limitations are recorded per claim."
  },
  {
    "source_id": "barrage-src-future-plan",
    "organisation": "PUB",
    "title": "Coastal Protection Plan for City-East Coast",
    "url": "https://www.pub.gov.sg/Public/KeyInitiatives/Flood-Resilience/Coastal-Protection/Coastal-Protection-Plan/City-East-Coast",
    "access_date": "2026-09-14",
    "publication_date": null,
    "update_date": null,
    "licence": "Copyright retained by source owner. Factual synthesis and links only; no media redistribution clearance.",
    "terms_url": null,
    "redistribution_status": "unverified",
    "intended_use": "Research and original schematic explanations; no source artwork, photographs, maps or drawings imported.",
    "asset_ids": [],
    "reliability_level": "primary",
    "notes": "Unknown publication dates retained as null; access date is not publication date. Source scope and limitations are recorded per claim."
  },
  {
    "source_id": "barrage-src-innovation",
    "organisation": "PUB",
    "title": "Innovation in Water, Volume 5",
    "url": "https://www.pub.gov.sg/-/media/Images/Feature/Content-Pages/Resources/R-and-D/Nov2013_5.pdf",
    "access_date": "2026-09-14",
    "publication_date": null,
    "update_date": null,
    "licence": "Copyright retained by source owner. Factual synthesis and links only; no media redistribution clearance.",
    "terms_url": null,
    "redistribution_status": "unverified",
    "intended_use": "Research and original schematic explanations; no source artwork, photographs, maps or drawings imported.",
    "asset_ids": [],
    "reliability_level": "primary",
    "notes": "Unknown publication dates retained as null; access date is not publication date. Source scope and limitations are recorded per claim."
  }
]
